{
  "_schema": "ruptura.vtt.content.escalpos.v1.3",
  "_meta": {
    "conteudo": "escalpos",
    "fonte": "Capitulo ESCALPOS (versao reescrita, upload de junho/2026)",
    "versao_schema": "1.3.0",
    "status_padrao": "published",
    "gerado_em": "2026-06-25",
    "total_registros": 58,
    "hash_sha256_origem": "fed1ff890918de5e9097b1cb8a2e0100f84f59485b92c3c82e44208db1fecea0",
    "regra_integridade": "Cada escalpo usa custo_integridade positivo. A ficha soma os custos instalados e subtrai da Integridade máxima do personagem.",
    "regra_slots": "Escalpos podem consumir pools globais, abrir pools por base ou abrir pools por instância. Upgrades de braços e pernas devem ser vinculados à instância específica do membro.",
    "regra_suplemento": "Escalpos consomem gas arcano, mas o jogo assume abastecimento normal; nao rastrear por sessao.",
    "observacoes": [
      "Campos textuais foram separados em descricao_curta e descricao_longa.",
      "Raridade foi normalizada como enum interno + label de exibição.",
      "Requisitos textuais conhecidos foram convertidos em requisitos estruturados.",
      "O antigo campo auto foi convertido para payload_automacao.efeitos.",
      "v1.1: alvo_tags normalizadas para IDs internos sem acento e em snake_case.",
      "v1.1: referencias a condicoes em payload foram normalizadas para IDs internos.",
      "v1.1: save foi padronizado como resistencia.",
      "v1.1: payload de Pulo Sismico restaurou PA e area, presentes na origem.",
      "v1.1: comandos de decks foram padronizados como objeto com modo lista/todos.",
      "v1.1: venenos do Beijo da Morte receberam ids e estrutura mecanica de falha/sucesso.",
      "v1.3: tipo_dano guarda tipo principal; subtipos como contundente ficam em subtipo_dano.",
      "v1.3: todos os subtipos físicos encontrados em tipo_dano foram normalizados para tipo_dano=fisico + subtipo_dano."
    ],
    "revisao": "v1.2: Pulo Sismico resistencia.pericia=\"resistir\" (invalido) -> acao Resistir (Vigor ou Mobilidade). | v1.3: tipo_dano contundente em Pulo Sismico normalizado para tipo_dano=fisico e subtipo_dano=contundente. | v1.3.1: lamina_retratil e garras_retrateis normalizadas para tipo_dano=fisico + subtipo_dano."
  },
  "enums": {
    "raridade": [
      "muito_comum",
      "comum",
      "incomum",
      "raro",
      "muito_raro"
    ],
    "status": [
      "draft",
      "published",
      "archived"
    ],
    "modo_slot": [
      "consome",
      "abre_pool"
    ],
    "tipo_pool": [
      "global",
      "aberto_por_escalpo_base",
      "por_instancia",
      "sem_limite_definido"
    ],
    "categorias": [
      "identidade",
      "moda",
      "neural",
      "interno",
      "optica",
      "audicao",
      "braco",
      "perna"
    ],
    "cadencia": [
      "cena",
      "dia",
      "descanso_longo",
      "sessao_malha"
    ],
    "condicoes": [
      "agarrado",
      "agarrando",
      "atordoado",
      "caido",
      "cego",
      "contundido",
      "envenenado",
      "imobilizado",
      "inconsciente",
      "insaturado",
      "lento",
      "ofuscado",
      "queimando",
      "sangrando",
      "saturado",
      "sufocando",
      "surdo"
    ],
    "tags_sistema": [
      "arma",
      "armazenamento",
      "ativo",
      "audicao",
      "balistica",
      "base",
      "braco",
      "carteira",
      "condicao_ignore",
      "escudo",
      "identidade",
      "interno",
      "logica",
      "luta",
      "mana",
      "mit",
      "mobilidade",
      "moda",
      "movimento",
      "neural",
      "optica",
      "passivo",
      "percepcao",
      "performance",
      "perna",
      "precisao",
      "ram",
      "reflexos",
      "resistencia",
      "sentido",
      "social",
      "trama",
      "utilitario",
      "vigor",
      "visao",
      "vontade"
    ],
    "tipo_efeito": [
      "abrir_pool_de_espaco",
      "acao_ativa",
      "acao_utilitaria",
      "alcance_utilitario",
      "arma_ou_ataque_integrado",
      "armazenamento_digital",
      "armazenamento_fisico",
      "comunicacao_silenciosa",
      "cura_extra",
      "deck_sinaptico",
      "efeito_com_resistencia",
      "efeito_textual_temporizado",
      "escudo_integrado",
      "habilitar_carteira",
      "habilitar_recurso",
      "identidade_forjada",
      "ignorar_condicao",
      "ignorar_penalidade_ambiental",
      "iluminacao",
      "mana_temporaria",
      "mit_subdermico",
      "modificador",
      "modificar_deslocamento",
      "modificar_salto",
      "ocultar_rastro_digital",
      "ram_bonus",
      "recurso_temporario",
      "reduzir_dano_queda",
      "traducao_neural",
      "upgrade_clandestino_opcional"
    ]
  },
  "pools_de_espaco": {
    "neural": {
      "id": "neural",
      "nome": "Neural",
      "tipo": "global",
      "capacidade": 4,
      "descricao": "Orçamento global de espaços neurais."
    },
    "interno": {
      "id": "interno",
      "nome": "Interno",
      "tipo": "global",
      "capacidade": 5,
      "descricao": "Orçamento global de espaços internos."
    },
    "optica": {
      "id": "optica",
      "nome": "Óptica",
      "tipo": "aberto_por_escalpo_base",
      "aberto_por": "optica_runica",
      "capacidade": 3,
      "descricao": "Pool aberto pela Óptica Rúnica."
    },
    "audicao": {
      "id": "audicao",
      "nome": "Audição",
      "tipo": "aberto_por_escalpo_base",
      "aberto_por": "audicao_runica",
      "capacidade": 2,
      "descricao": "Pool aberto pela Audição Rúnica."
    },
    "braco": {
      "id": "braco",
      "nome": "Braço",
      "tipo": "por_instancia",
      "aberto_por": "braco_runico",
      "capacidade_por_unidade": 2,
      "max_unidades": 2,
      "instancias_sugeridas": [
        "braco_esquerdo",
        "braco_direito"
      ],
      "descricao": "Cada Braço Rúnico instalado abre um pool próprio de 2 espaços."
    },
    "perna": {
      "id": "perna",
      "nome": "Perna",
      "tipo": "por_instancia",
      "aberto_por": "perna_runica",
      "capacidade_por_unidade": 3,
      "max_unidades": 2,
      "instancias_sugeridas": [
        "perna_esquerda",
        "perna_direita"
      ],
      "descricao": "Cada Perna Rúnica instalada abre um pool próprio de 3 espaços."
    },
    "moda": {
      "id": "moda",
      "nome": "Moda",
      "tipo": "sem_limite_definido",
      "capacidade": null,
      "descricao": "O capítulo não declara orçamento máximo para escalpos de moda. A ficha registra consumo, mas não bloqueia por limite."
    },
    "identidade": {
      "id": "identidade",
      "nome": "Identidade",
      "tipo": "sem_limite_definido",
      "capacidade": null,
      "descricao": "O capítulo não declara orçamento máximo para escalpos de identidade. A ficha registra itens de identidade sem bloquear por limite."
    }
  },
  "escalpos": [
    {
      "id": "rpi_oficial",
      "slug": "rpi_oficial",
      "nome": "Registro Pessoal Imperial (RPI)",
      "categoria": "identidade",
      "categoria_label": "Identidade",
      "raridade": "muito_comum",
      "raridade_label": "Muito Comum",
      "preco": 0,
      "custo_integridade": 0,
      "slot": null,
      "requisitos": [],
      "tags": [
        "identidade"
      ],
      "descricao_curta": "Gera o ID sinaptico; necessario para verificacoes, transacoes formais e acesso a Malha oficial.",
      "descricao_longa": "Gera o ID sinaptico; necessario para verificacoes, transacoes formais e acesso a Malha oficial. Sustenta a CDI. Sem ele, o personagem nao existe no sistema imperial.",
      "payload_automacao": {
        "efeitos": [
          {
            "tipo": "habilitar_recurso",
            "recursos": [
              "cdi_oficial",
              "id_sinaptico"
            ]
          }
        ],
        "observacoes": [
          "Personagem refratario tipicamente NAO tem RPI oficial valido; opera com RPI Forjado."
        ]
      },
      "status": "published",
      "versao": "1.0.0",
      "created_at": "2026-06-25",
      "updated_at": "2026-06-25"
    },
    {
      "id": "rpi_forjado_1",
      "slug": "rpi_forjado_1",
      "nome": "RPI Forjado (Nível 1)",
      "categoria": "identidade",
      "categoria_label": "Identidade",
      "raridade": "comum",
      "raridade_label": "Comum",
      "preco": 300,
      "custo_integridade": 0,
      "slot": null,
      "requisitos": [],
      "tags": [
        "identidade"
      ],
      "descricao_curta": "Replica perfil sinaptico de baixo escalao.",
      "descricao_longa": "Replica perfil sinaptico de baixo escalao. Funciona em areas perifericas e sistemas desatualizados. Falha automaticamente contra scanners modernos.",
      "payload_automacao": {
        "efeitos": [
          {
            "tipo": "identidade_forjada",
            "confiabilidade": "baixa",
            "falha_automatica": "scanners modernos"
          }
        ]
      },
      "status": "published",
      "versao": "1.0.0",
      "created_at": "2026-06-25",
      "updated_at": "2026-06-25"
    },
    {
      "id": "rpi_forjado_2",
      "slug": "rpi_forjado_2",
      "nome": "RPI Forjado (Nível 2)",
      "categoria": "identidade",
      "categoria_label": "Identidade",
      "raridade": "incomum",
      "raridade_label": "Incomum",
      "preco": 1000,
      "custo_integridade": 0,
      "slot": null,
      "requisitos": [],
      "tags": [
        "identidade"
      ],
      "descricao_curta": "Identidade reciclada de morto ou desaparecido.",
      "descricao_longa": "Identidade reciclada de morto ou desaparecido. Funciona em distritos comuns; 20% de chance de falhar em zonas nobres ou checkpoints imperiais.",
      "payload_automacao": {
        "efeitos": [
          {
            "tipo": "identidade_forjada",
            "confiabilidade": "media",
            "chance_falha_zonas_nobres": 0.2
          }
        ]
      },
      "status": "published",
      "versao": "1.0.0",
      "created_at": "2026-06-25",